episodenbr,title,weekday,broadcastdate,broadcasthour,duration,views,share,AI,chart,summary
521,Nightmare of Eden: Part Four,Sat,15 Dec 1979,5:56pm,00:24:31,9.40m,,65.0,32,"The Doctor solves the mystery of the drug smuggling racket and the culprits are revealed. But unless the Doctor and Romana act quickly, the villains will escape justice."
522,The Horns of Nimon: Part One,Sat,22 Dec 1979,6:11pm,00:25:41,6.00m,,,100,"With the TARDIS disabled for repairs, the Doctor is powerless to act when Romana is kidnapped by a battleship en route to Skonnos and the formidable Nimon."
523,The Horns of Nimon: Part Two,Sat,29 Dec 1979,5:54pm,00:25:00,8.80m,,,56,"On Skonnos, Romana and the Athenian youngsters are forced into the labyrinth of the power complex to meet their fate at the hands of the Nimon."
524,The Horns of Nimon: Part Three,Sat,5 Jan 1980,6:21pm,00:23:26,9.80m,,,40,"Trapped inside the power complex, the Doctor and Romana begin to suspect that the Nimon is only the first of a full scale invasion."
525,The Horns of Nimon: Part Four,Sat,12 Jan 1980,6:06pm,00:26:45,10.40m,,67.0,26,"On the dying world of Crinoth, Romana discovers the truth behind the Nimon's empty promises. The Doctor must find a way to shut down the power complex on Skonnos."
526,The Leisure Hive: Part One,Sat,30 Aug 1980,6:14pm,00:23:33,5.90m,,,77,"The Doctor and Romana visit the Leisure Hive on Argolis. The Argolins, survivors of a war, run the Hive as a tourist attraction but its future is jeopardised by a series of deaths."
527,The Leisure Hive: Part Two,Sat,6 Sep 1980,6:20pm,00:20:45,5.00m,,,103,"The Tachyon Recreation Generator is the cause of the mysterious deaths at the Leisure Hive. Romana makes repairs, and the Doctor becomes a reluctant guinea pig."
528,The Leisure Hive: Part Three,Sat,13 Sep 1980,5:57pm,00:21:21,5.00m,,,111,"The Tachyon Generator has aged the Doctor into a white haired old man, but he discovers the truth behind the machine and uncovers a plot to take control of the Hive."
529,The Leisure Hive: Part Four,Sat,20 Sep 1980,6:15pm,00:21:19,4.50m,,65.0,111,The obsessed Pangol is determined to give Argolis a future with himself as the leader of the reborn race. He plans to strike back at the Foamasi.
530,Meglos: Part One,Sat,27 Sep 1980,6:16pm,00:24:43,5.00m,,61.0,105,"On Zolfa-Thura, Meglos plans to steal the ancient and powerful Dodecahedron from the neighbouring world of Tigella. But first, the Doctor must be prevented from interfering."
531,Meglos: Part Two,Sat,4 Oct 1980,6:17pm,00:21:24,4.20m,,64.0,139,"Masquerading as the Doctor, Meglos penetrates the underground city of Tigella. The Doctor and Romana are trapped in an ever repeating circle of time and seem powerless to act."
532,Meglos: Part Three,Sat,11 Oct 1980,5:42pm,00:21:19,4.70m,,,129,Meglos escapes with the Dodecahedron and the Doctor is mistakenly held responsible for the theft. He is sentenced to a gruesome death as punishment for his crime.
533,Meglos: Part Four,Sat,18 Oct 1980,5:44pm,00:19:30,4.70m,,63.0,127,The Doctor must convince the Tigellans of his innocence if he is to prevent Meglos from using the dodecahedron to destroy their world.
534,Full Circle: Part One,Sat,25 Oct 1980,5:40pm,00:24:23,5.90m,,,106,The TARDIS enters the universe of E-Space and lands on the planet Alzarius where Mistfall is occurring and creatures are stirring in the swamp.
535,Full Circle: Part Two,Sat,1 Nov 1980,5:42pm,00:22:11,3.70m,,,170,The Doctor and K-9 are stranded when the TARDIS is stolen by the Marshmen. Romana encounters the Outlers who are regretting their decision not to return to the Starliner.
536,Full Circle: Part Three,Sat,8 Nov 1980,5:42pm,00:22:00,5.90m,,,115,Romana has been infected by the bite of a marsh spider and the Doctor discovers that the ruling Deciders have been perpetuating a lie to their own people.
537,Full Circle: Part Four,Sat,15 Nov 1980,5:40pm,00:24:16,5.50m,,65.0,127,The Marshmen are on the rampage through the ship and the Doctor finally uncovers the tragic truth of the Starliner.
538,State of Decay: Part One,Sat,22 Nov 1980,5:42pm,00:22:24,5.80m,,,119,The TARDIS lands on a world in E-Space where the primitive inhabitants live in fear of the Three Who Rule.
539,State of Decay: Part Two,Sat,29 Nov 1980,5:41pm,00:23:16,5.30m,,,136,The Doctor and Romana are taken to the tower and meet the three mysterious rulers. But an ancient evil slumbers beneath their feet.
540,State of Decay: Part Three,Sat,6 Dec 1980,5:40pm,00:24:13,4.40m,,,145,Adric is taken prisoner by the three vampire rulers. The Doctor discovers that they are facing a mighty foe from Time Lord history.
541,State of Decay: Part Four,Sat,13 Dec 1980,5:39pm,00:24:54,5.40m,,69.0,125,"As the Great Vampire begins to awaken from his long sleep, the Doctor formulates a desperate plan to defeat the ancient enemy of his people."
542,Warriors' Gate: Part One,Sat,3 Jan 1981,5:20pm,00:22:54,7.10m,,59.0,88,"The TARDIS is drawn into an empty white void, somewhere between universes. But they are not the only ones trapped there."
543,Warriors' Gate: Part Two,Sat,10 Jan 1981,5:09pm,00:23:47,6.70m,,,93,"When Rorvik learns that Romana is a time sensitive, he takes her prisoner, forcing her to find a way out of the void. The Doctor attempts to discover what lies beyond the mirror."
544,Warriors' Gate: Part Three,Sat,17 Jan 1981,5:11pm,00:22:15,8.30m,,,59,"As the void begins to shrink around them, Rorvik plans to take desperate measures to escape through the mirror. The Doctor discovers the dark secret of the Tharils' past."
545,Warriors' Gate: Part Four,Sat,24 Jan 1981,5:09pm,00:24:53,7.80m,,59.0,69,"With the void collapsing around them, time is running out. Rorvik ignores the Doctor's warnings and takes a desperate gamble which could have fatal consequences."
546,The Keeper of Traken: Part One,Sat,31 Jan 1981,5:09pm,00:24:05,7.60m,,,72,"The Keeper of Traken is nearing the end of his long reign. Fearing a terrible evil is about to threaten the peace and harmony of his world, he requests the Doctor's help."
547,The Keeper of Traken: Part Two,Sat,7 Feb 1981,5:08pm,00:24:50,6.10m,,,106,"As Melkur begins to return to life, he manipulates Kassia into doing its bidding. The Doctor and Adric are held responsible for the evil that has come to Traken."
548,The Keeper of Traken: Part Three,Sat,14 Feb 1981,5:09pm,00:23:49,5.20m,,,112,The Keeper nears the end of his life and Melkur is poised to take control of the all-powerful source manipulator.
549,The Keeper of Traken: Part Four,Sat,21 Feb 1981,5:12pm,00:25:11,6.10m,,63.0,103,"Melkur has become the new Keeper of Traken and begins to access the source manipulator. As the Doctor takes steps to stop him, he discovers the frightening truth about his enemy."
550,Logopolis: Part One,Sat,28 Feb 1981,5:09pm,00:24:32,7.10m,,,84,"Deciding to repair the TARDIS' chameleon circuit, the Doctor goes to Earth to find a real police box. But an old enemy is one step ahead of him."
551,Logopolis: Part Two,Sat,7 Mar 1981,5:09pm,00:24:03,7.70m,,61.0,57,"The Doctor, aware that his time may soon be ending, travels to the Logopolis where a series of fateful events are set in motion."
552,Logopolis: Part Three,Sat,14 Mar 1981,5:11pm,00:24:32,5.80m,,,102,The Master is loose on Logopolis and is determined to learn its secret. But there is more at stake than he realises and his meddling has endangered the entire universe.
553,Logopolis: Part Four,Sat,21 Mar 1981,5:09pm,00:25:10,6.10m,,65.0,97,"With the fate of the universe hanging in the balance, the Doctor and the Master are forced to return to Earth and carry out their plan. But for the Fourth Doctor, it's the end"
554,Castrovalva: Part One,Mon,4 Jan 1982,6:56pm,00:24:14,9.10m,,,54,"The Doctor tries to recuperate within the Zero Room, leaving Nyssa, Adric and Tegan to face the Master. Then Adric is taken and the TARDIS plunges towards Event One..."
555,Castrovalva: Part Two,Tue,5 Jan 1982,7:02pm,00:24:13,8.60m,,,84,"The Zero Room is gone and the Doctor's regeneration is dangerously unstable. To help him, Tegan locates the tranquil world of Castrovalva and the TARDIS heads there."
556,Castrovalva: Part Three,Mon,11 Jan 1982,6:55pm,00:23:35,10.20m,,,47,"Something is wrong with Castrovalva, but the Portreeve cannot help the Doctor identify the problem. And the Master is taunting Adric, caught in his web of power"
557,Castrovalva: Part Four,Tue,12 Jan 1982,7:05pm,00:24:12,10.40m,,,46,"As recursive occlusion threatens to destroy everything and everyone in Castrovalva, the Master's space/time trap is revealed, with Adric at its heart..."
558,Four To Doomsday: Part One,Mon,18 Jan 1982,6:56pm,00:23:36,8.40m,,,66,"The arrival of the TARDIS is observed by three Urbankans via their manopticon devices. Intrigued, they begin dividing the Doctor's friends, and disguising themselves as humans"
559,Four To Doomsday: Part Two,Tue,19 Jan 1982,7:05pm,00:24:11,8.80m,,,61,"As the Doctor meets the representatives of humanity aboard the Urbankan ship, a Grecian philosopher reveals a bizarre secret about Monarch and his methods"
560,Four To Doomsday: Part Three,Mon,25 Jan 1982,6:56pm,00:24:09,8.80m,,,63,"Panicking, Tegan accidentally pilots the TARDS into space. Meanwhile Lin Fitu betrays the Doctor and Bigon to Monarch, who demands they be beheaded as punishment."
561,Four To Doomsday: Part Four,Tue,26 Jan 1982,7:06pm,00:24:53,9.40m,,,53,The Doctor takes a dangerous spacewalk to rescue Tegan while Nyssa and Bigon keep the Urbankans distracted. Adric decides exactly whose side he is on
562,Kinda: Part One,Mon,1 Feb 1982,6:57pm,00:24:50,8.40m,,,78,"While Nyssa rests, Adric and the Doctor discover a military expedition on Deva Loka. Tegan falls asleep in the forest watched by the Kinda, but they cannot stop her dreams."
563,Kinda: Part Two,Tue,2 Feb 1982,7:04pm,00:24:58,9.40m,,,45,"Sanders meets Panna and Karuna who leave a lasting impression on him, while the Dukkha does the same on Tegan. When Hindle's breakdown begins, the Doctor and Todd are in danger"
564,Kinda: Part Three,Mon,8 Feb 1982,6:56pm,00:24:17,8.50m,,,67,"Aris now carries the mark of the Mara and has gained voice, so Panna shows the Doctor and Todd exactly what the past, present and future hold for Deva Loka."
565,Kinda: Part Four,Tue,9 Feb 1982,7:05pm,00:24:28,8.90m,,,56,"As the Mara finally breaks free of its dream dimension, the Kinda must do everything they can to contain it. Hindle's need to destroy everything and everyone is unstoppable"
566,The Visitation: Part One,Mon,15 Feb 1982,6:57pm,00:24:11,9.10m,,,54,The TARDIS lands in 17th century England which is being stalked by a robotic death-like figure. The locals seem to be under a strange mesmeric spell.
567,The Visitation: Part Two,Tue,16 Feb 1982,7:05pm,00:24:26,9.30m,,,48,A Terileptil is living in Sir John's basement and is planning to wipe out mankind with plague rats. It decides to arrange for the Doctor and Richard Mace to be beheaded.
568,The Visitation: Part Three,Mon,22 Feb 1982,6:57pm,00:24:24,9.90m,,,41,"Nyssa and Adric, pursued by the Android, head to the safety of the TARDIS. Meanwhile a mesmerised Tegan prepares to unleash the rats on the Doctor and Mace..."
569,The Visitation: Part Four,Tue,23 Feb 1982,7:05pm,00:23:32,10.10m,,,40,"The Doctor discovers more Terileptil criminals in hiding in London. As he battles them, their soliton gas generator explodes, setting the city ablaze..."
570,Black Orchid: Part One,Mon,1 Mar 1982,6:56pm,00:24:56,9.90m,,,57,"A murder is committed in Cranleigh Hall. The Cranleighs ask the Doctor to play cricket and then join them for a masked ball, enabling the killer to hide in plain sight."
571,Black Orchid: Part Two,Tue,2 Mar 1982,7:04pm,00:24:41,10.10m,,,55,"The Doctor stands accused, despite Lady Cranleigh knowing he is innocent. What is the secret she is protecting that allows her to let an honest man go to jail?"
572,Earthshock: Part One,Mon,8 Mar 1982,6:56pm,00:24:22,9.10m,,,45,"Deadly androids are protecting a bomb buried beneath the Earth from all investigation. However, the Doctor manages to disable it, alerting its owners  the Cybermen..."
573,Earthshock: Part Two,Tue,9 Mar 1982,7:05pm,00:24:23,8.80m,,,50,"With her crew vanishing mysteriously, Captain Briggs assumes the Doctor is the guilty party, but the traitor is closer to home as are the Cybermen."
574,Earthshock: Part Three,Mon,15 Mar 1982,6:57pm,00:24:24,9.80m,,,32,"The Cybermen are released from their silos and are on the march, attacking Briggs's crew and ensuring that the freighter remains on course for Earth. But why?"
575,Earthshock: Part Four,Tue,16 Mar 1982,7:03pm,00:24:28,9.60m,,,40,The Doctor realises the freighter is now a huge bomb and sends it back through time where it can explode millions of years ago... but Adric is still aboard...
576,Time-Flight: Part One,Mon,22 Mar 1982,6:57pm,00:24:56,10.00m,,,26,"When a Speedbird Concorde disappears back through a crack in time, the Doctor takes another Concorde to follow its trail, unaware that a mysterious conjuror, Kalid, waits for him."
577,Time-Flight: Part Two,Tue,23 Mar 1982,7:05pm,00:23:58,8.50m,,,48,"After an encounter with the Plasmatons, Nyssa is possessed by strange aliens while the Doctor, joined by Professor Hayter, investigates Kalid's inner sanctum."
578,Time-Flight: Part Three,Mon,29 Mar 1982,6:56pm,00:24:29,8.90m,,,46,"From within their sarcophagus, the gestalt Xeraphin are communicating through Nyssa. But their psychic energy is so powerful it may destroy her body completely."
579,Time-Flight: Part Four,Tue,30 Mar 1982,6:51pm,00:24:30,8.10m,,,64,"The Master's TARDIS is repaired and the Doctor must follow him back to 20th century Heathrow, once he has rescued all the passengers and crew from both Concordes."
580,Arc of Infinity: Part One,Mon,3 Jan 1983,6:45pm,00:24:37,7.20m,,69.0,74,"During a clandestine meeting on Gallifrey, the Doctor has been chosen to be a part of a terrible act. Unaware, the Doctor and Nyssa trace something odd to Amsterdam"
581,Arc of Infinity: Part Two,Wed,5 Jan 1983,6:46pm,00:24:42,7.30m,,70.0,66,Commander Maxil doesn't believe the Doctor is innocent and reckons the easiest way to stop the evil being reborn on Gallifrey would be to kill him before the bonding can occur
582,Arc of Infinity: Part Three,Tue,11 Jan 1983,6:51pm,00:24:37,6.90m,,67.0,89,"President Borusa thinks the creature has been defeated but within the Matrix, the Doctor unmasks Omega and realises the threat to the matter universe is far from over"
583,Arc of Infinity: Part Four,Wed,12 Jan 1983,6:46pm,00:24:28,7.20m,,66.0,82,"Omega has been reborn in Amsterdam in the Doctor's form, but the transference hasn't worked. The Doctor pursues him through the city, aware Omega is now a walking anti-matter bomb"
584,Snakedance: Part One,Tue,18 Jan 1983,6:50pm,00:24:26,6.70m,,65.0,95,"Five hundred years after being exiled, the Mara is returning home to the planet Manussa. And it is using Tegan's subconscious to get there in the TARDIS"
585,Snakedance: Part Two,Wed,19 Jan 1983,6:46pm,00:24:35,7.70m,,66.0,75,"As Tegan tries to rid her mind of the Mara forever, the Doctor learns about the Little Mind's Eye crystal, while coping with the local politics of the Federator..."
586,Snakedance: Part Three,Tue,25 Jan 1983,6:50pm,00:24:29,6.60m,,67.0,66,"As Tegan and Lon combine to give the Mara access back to reality, the Doctor locates the Great Mind's Eye crystal but realises it is instrumental in the Mara's plan."
587,Snakedance: Part Four,Wed,26 Jan 1983,6:44pm,00:24:29,7.40m,,67.0,74,"The Doctor and the original snakedancer Dojeen work to rid the planet of the malign Mara once and for all, but it has the whole of Manussa in its psychic grip now"
588,Mawdryn Undead: Part One,Tue,1 Feb 1983,6:50pm,00:24:03,6.50m,,67.0,103,"Caught in a warp ellipse, the TARDIS is drawn to a huge spacecraft orbiting Earth whereupon the Doctor is separated in space and time from Nyssa and Tegan."
589,Mawdryn Undead: Part Two,Wed,2 Feb 1983,6:46pm,00:24:33,7.50m,,70.0,83,"At Brendon School, the Doctor enlists the help of the Brigadier. At Brendon School, Tegan enlists the help of the Brigadier. Same man, but different time periods..."
590,Mawdryn Undead: Part Three,Tue,8 Feb 1983,6:49pm,00:24:32,7.40m,,67.0,84,"Mawdryn and his eternal mutants reveal the truth: they are exiles, they are in pain and need the Doctor's his future 'lives', as afforded by each of his remaining regenerations."
591,Mawdryn Undead: Part Four,Wed,9 Feb 1983,6:47pm,00:24:33,7.70m,,68.0,78,"As the Doctor's ethics are challenged and the two Brigadiers finally meet, Turlough plots with the Black Guardian to bring the Time Lord down once and for all..."
592,Terminus: Part One,Tue,15 Feb 1983,6:54pm,00:24:58,6.80m,,65.0,86,"Turlough sabotages the TARDIS causing it to fuse with the space station Terminus. Trying to separate the two, the Doctor encounters a couple of space pirates."
593,Terminus: Part Two,Wed,16 Feb 1983,6:46pm,00:24:40,7.50m,,67.0,75,"While the other Vanir dealt with their hydromel, the curious Bor took a journey to try and solve the mystery at the heart of Terminus itself. And now he knows the secrets"
594,Terminus: Part Three,Tue,22 Feb 1983,6:54pm,00:24:39,6.50m,,64.0,97,"Trapped with the Lazars, Nyssa tries to find a way to help them while the Doctor and Kari find the original pilot of Terminus and realise his mistake is about to be repeated..."
595,Terminus: Part Four,Wed,23 Feb 1983,6:46pm,00:24:49,7.40m,,67.0,80,"The Garm and the pirates stop Terminus setting off a second Big Bang, while the Vanir fight between themselves for their future. Meanwhile Nyssa makes a monumental decision..."
596,Enlightenment: Part One,Tue,1 Mar 1983,6:55pm,00:24:12,6.60m,,67.0,89,The TARDIS's power is drained away just as the Doctor receives a dire warning from the White Guardian. He soon finds himself drawn into a strange race through the stars...
597,Enlightenment: Part Two,Wed,2 Mar 1983,6:45pm,00:24:23,7.20m,,65.0,76,"While Tegan has to cope with the unwelcome attention of Marriner, the Doctor realises that Striker and his officers are Eternals and that the human crew mean nothing to them..."
598,Enlightenment: Part Three,Tue,8 Mar 1983,6:54pm,00:24:40,6.20m,,68.0,99,"Captain Wrack manipulates Turlough, because she is also working for the Black Guardian. During an Eternals party she places a bomb aboard Striker's ship."
599,Enlightenment: Part Four,Wed,9 Mar 1983,6:46pm,00:24:34,7.30m,,70.0,68,The race for the Enlightenment is over and a winner has been crowned. But Turlough must make a decision and it's one the Doctor and Tegan cannot help him with...
600,The King's Demons: Part One,Tue,15 Mar 1983,6:55pm,00:24:48,5.80m,,65.0,107,"The TARDIS appears at a medieval joust between Frenchman Sir Gilles and Hugh Fitzwilliam. But King John seems more curious than alarmed, as is Sir Gilles..."
701,World War Three,Sat,23 Apr 2005,7:01pm,00:40:40,7.98m,40.2%,81.0,20,
702,Dalek,Sat,30 Apr 2005,6:59pm,00:45:20,8.63m,44.9%,84.0,14,
703,The Long Game,Sat,7 May 2005,7:00pm,00:44:25,8.01m,40.4%,81.0,17,
704,Father's Day,Sat,14 May 2005,7:01pm,00:42:50,8.06m,44.4%,83.0,17,"When Rose travels back to the day of her father's death, her meddling in the course of events has terrible consequences for the human race - in the form of the fiendish Reapers.

Synopsis Source: Radio Times"
705,The Empty Child,Sat,21 May 2005,6:29pm,00:41:50,7.11m,37.0%,84.0,21,
706,The Doctor Dances,Sat,28 May 2005,6:59pm,00:42:50,6.86m,39.0%,85.0,18,
707,Boom Town,Sat,4 Jun 2005,7:01pm,00:43:15,7.68m,39.0%,82.0,18,
708,Bad Wolf,Sat,11 Jun 2005,7:00pm,00:42:50,6.81m,37.9%,86.0,19,
709,The Parting of the Ways,Sat,18 Jun 2005,6:59pm,00:45:30,6.91m,44.0%,89.0,17,
710,The Christmas Invasion,Sun,25 Dec 2005,7:02pm,00:58:55,9.84m,43.5%,84.0,9,"The newly regenerated Doctor takes Rose home for the festive season, but
 the transition process has tired him and he falls unconscious - just as
 the planet comes under threat from evil alien race the Sycorax, who 
have employed sinister Santas and murderous trees to do their bidding."
711,New Earth,Sat,15 Apr 2006,7:16pm,00:44:05,8.62m,40.2%,85.0,9,
712,Tooth and Claw,Sat,22 Apr 2006,7:18pm,00:44:30,9.24m,42.9%,83.0,10,
713,School Reunion,Sat,29 Apr 2006,7:23pm,00:44:10,8.31m,41.6%,85.0,12,
714,The Girl in the Fireplace,Sat,6 May 2006,6:59pm,00:44:40,7.90m,38.1%,84.0,13,
715,Rise of the Cybermen,Sat,13 May 2006,7:23pm,00:46:05,9.22m,43.7%,86.0,6,"On a parallel Earth where Rose's parents remained together, the Doctor sees a terrifying enemy reborn... The Cybermen are coming!"
716,The Age of Steel,Sat,20 May 2006,6:38pm,00:45:50,7.64m,37.8%,86.0,15,The Cybermen take control of London and start converting the populace. It looks like even the Doctor is beaten...
717,The Idiot's Lantern,Sat,27 May 2006,7:00pm,00:45:10,6.76m,33.4%,84.0,18,
718,The Impossible Planet,Sat,3 Jun 2006,7:00pm,00:45:20,6.32m,41.0%,85.0,18,"The Doctor and Rose land in a base on an 'impossible planet'. But the TARDIS is missing, there's a killer in the base, and who are the Ood?"
719,The Satan Pit,Sat,10 Jun 2006,7:01pm,00:47:10,6.08m,38.0%,86.0,19,"As Rose battles the murderous Ood, the Doctor must grapple with a monster that challenges his every belief: the Beast."
720,Love & Monsters,Sat,17 Jun 2006,7:00pm,00:45:05,6.66m,39.7%,76.0,15,
721,Fear Her,Sat,24 Jun 2006,7:02pm,00:43:50,7.14m,41.2%,83.0,20,
722,Army of Ghosts,Sat,1 Jul 2006,7:01pm,00:43:20,8.19m,45.1%,86.0,7,"The Cybermen have invaded Earth, but the Doctor and Torchwood are about to confront an even greater threat."
723,Doomsday,Sat,8 Jul 2006,6:59pm,00:46:25,8.22m,44.5%,89.0,8,"As the human race is caught in a war between Daleks and Cybermen, the Doctor faces losing Rose."
724,The Runaway Bride,Mon,25 Dec 2006,7:00pm,01:00:00,9.38m,37.9%,84.0,10,
725,Smith and Jones,Sat,31 Mar 2007,7:00pm,00:44:25,8.71m,40.7%,88.0,9,The script is available to read from the BBC Writers Room.
726,The Shakespeare Code,Sat,7 Apr 2007,6:59pm,00:45:35,7.23m,36.9%,87.0,14,
727,Gridlock,Sat,14 Apr 2007,7:40pm,00:44:58,8.40m,40.4%,85.0,7,
728,Daleks in Manhattan,Sat,21 Apr 2007,6:36pm,00:46:55,6.69m,36.4%,87.0,18,The Doctor finds his oldest enemies at work on top of the Empire State Building when he and Martha travel to 1930s New York.
729,Evolution of the Daleks,Sat,28 Apr 2007,6:44pm,00:46:25,6.97m,39.2%,85.0,17,"As a new Dalek Empire rises in 1930s New York, the Doctor must enter an unholy alliance."
730,The Lazarus Experiment,Sat,5 May 2007,7:00pm,00:43:00,7.19m,38.8%,86.0,12,
731,42,Sat,19 May 2007,7:15pm,00:45:25,7.41m,37.1%,84.0,16,"As a spaceship hurtles towards the sun, the Doctor and Martha have only 42 minutes to save the day!"
732,Human Nature,Sat,26 May 2007,7:11pm,00:45:00,7.74m,38.0%,86.0,13,
733,The Family of Blood,Sat,2 Jun 2007,7:12pm,00:42:55,7.21m,40.9%,86.0,13,
734,Blink,Sat,9 Jun 2007,7:10pm,00:43:40,6.62m,38.4%,87.0,16,
735,Utopia,Sat,16 Jun 2007,7:15pm,00:45:50,7.84m,38.2%,87.0,14,
736,The Sound of Drums,Sat,23 Jun 2007,7:15pm,00:46:10,7.51m,40.0%,87.0,11,
737,Last of the Time Lords,Sat,30 Jun 2007,7:05pm,00:51:25,8.61m,40.6%,88.0,10,
738,Voyage of the Damned,Tue,25 Dec 2007,6:51pm,01:11:50,13.31m,51.6%,85.0,2,
739,Partners in Crime,Sat,5 Apr 2008,6:19pm,00:48:30,9.14m,41.3%,88.0,10,
740,The Fires of Pompeii,Sat,12 Apr 2008,6:46pm,00:48:15,9.04m,38.8%,87.0,10,
741,Planet of the Ood,Sat,19 Apr 2008,6:19pm,00:43:35,7.50m,35.2%,87.0,12,
742,The Sontaran Stratagem,Sat,26 Apr 2008,6:19pm,00:44:30,7.06m,36.9%,87.0,17,
743,The Poison Sky,Sat,3 May 2008,6:19pm,00:44:40,6.53m,34.3%,88.0,18,
744,The Doctor's Daughter,Sat,10 May 2008,6:44pm,00:45:10,7.33m,40.1%,88.0,10,
745,The Unicorn and the Wasp,Sat,17 May 2008,6:58pm,00:44:40,8.41m,37.8%,86.0,7,
746,Silence in the Library,Sat,31 May 2008,7:02pm,00:43:00,6.27m,27.7%,89.0,27,
747,Forest of the Dead,Sat,7 Jun 2008,7:00pm,00:45:20,7.84m,42.1%,89.0,10,
748,Midnight,Sat,14 Jun 2008,7:10pm,00:43:50,8.05m,39.8%,86.0,5,
749,Turn Left,Sat,21 Jun 2008,6:38pm,00:49:25,8.09m,38.1%,88.0,4,
750,The Stolen Earth,Sat,28 Jun 2008,7:11pm,00:45:40,8.78m,42.1%,91.0,2,
751,Journey's End,Sat,5 Jul 2008,6:40pm,01:03:05,10.57m,48.7%,91.0,1,
752,The Next Doctor,Thu,25 Dec 2008,6:00pm,01:00:40,13.10m,52.1%,86.0,2,
753,Planet of the Dead,Sat,11 Apr 2009,6:44pm,00:58:55,9.74m,41.7%,88.0,5,"A London bus takes a detour to an alien world, but can the Doctor defeat the Swarm?"
754,The Waters of Mars,Sun,15 Nov 2009,6:59pm,01:02:05,10.32m,35.3%,88.0,5,"Mars, 2059. Bowie Base One. Last recorded message: 'Don't drink the water. Not one drop.'"
755,The End of Time: Part One,Fri,25 Dec 2009,5:59pm,00:59:35,12.04m,44.7%,87.0,1,
756,The End of Time: Part Two,Fri,1 Jan 2010,6:41pm,01:12:35,12.27m,40.0%,89.0,1,
757,The Eleventh Hour,Sat,3 Apr 2010,6:21pm,01:02:35,10.08m,39.7%,86.0,3,
758,The Beast Below,Sat,10 Apr 2010,6:20pm,00:41:25,8.42m,38.9%,86.0,10,
759,Victory of the Daleks,Sat,17 Apr 2010,6:29pm,00:41:15,7.82m,37.4%,84.0,11,
760,The Time of Angels,Sat,24 Apr 2010,6:23pm,00:40:55,8.59m,41.2%,87.0,8,
761,Flesh and Stone,Sat,1 May 2010,6:27pm,00:41:40,8.50m,38.2%,86.0,11,
762,The Vampires of Venice,Sat,8 May 2010,5:59pm,00:47:25,7.68m,34.8%,86.0,12,
763,Amy's Choice,Sat,15 May 2010,6:24pm,00:43:25,7.55m,37.4%,84.0,13,
764,The Hungry Earth,Sat,22 May 2010,6:18pm,00:42:50,6.49m,39.8%,86.0,19,The reptilian Silurians are the former rulers of Earth. A drilling project awakens them - and now they want their planet back!
765,Cold Blood,Sat,29 May 2010,7:01pm,00:44:55,7.49m,31.9%,86.0,9,Mankind and the Silurians teeter on the brink of all-out war. Can the Doctor ensure the two species' survival?
766,Vincent and the Doctor,Sat,5 Jun 2010,6:41pm,00:46:05,6.76m,35.5%,86.0,17,
767,The Lodger,Sat,12 Jun 2010,6:47pm,00:41:15,6.44m,28.5%,87.0,20,
768,The Pandorica Opens,Sat,19 Jun 2010,6:39pm,00:48:40,7.58m,37.1%,88.0,10,"The Doctor confronts an army of old enemies, and Amy battles a Cyberman. And then the Pandorica opens..."
